SAMN10612710	 To extract the required information from the given JSON data, we need to go step by step as follows:  1. tissue - The input data contains the key "tissue" with the value "peripheral blood", so we will include it in our output JSON. 2. host tissue - There is no mention of any content collected from a tissue, so we will not include this attribute in our output JSON. 3. cell line - The input data does not contain any information about a cell line, so we will not include this attribute in our output JSON. 4. cell type - The input data contains the key "source\_name" with the value "CD14+ monocytes", which indicates that the sample is a specific type of cell, so we will include it in our output JSON. 5. disease - The input data contains the key "origin" with the value "dcSSc patient", which suggests that the sample was collected from a patient with diffuse cutaneous systemic sclerosis (dcSSc). Therefore, we will include this attribute in our output JSON.  Based on the above analysis, our output JSON-formatted data would be: ```json {     "tissue": "peripheral blood",     "cell_type": "CD14+ monocytes",     "disease": "diffuse cutaneous systemic sclerosis" } ```
SAMN10721769	 Based on the given JSON data, here are the extracted information:  * The sample is a cell line, and its name is SAH. So, the output will include `"cell_line": "SAH"`. * The sample is also a specific type of cell, which is an induced pluripotent stem cell line. So, the output will include `"cell_type": "induced pluripotent stem cell line"`.  The final output in JSON format: ```json {     "cell_line": "SAH",     "cell_type": "induced pluripotent stem cell line" } ``` Additional notes:  * The sample is not considered to be a tissue section or a whole tissue, so there is no `tissue` attribute. * There is no information about the content collected from a tissue, so there is no `host_tissue` attribute. * The output does not include any disease name because there is no such information in the input data.
SAMN10861451	 Sure, I will think step by step to extract the required information from the given JSON data.  The input data is: ```json {     "accession": "SAMN10861451",     "cell type": "Breast cancer",     "chip antibody": "ab5089",     "organism": "Homo sapiens",     "passages": "34",     "source_name": "MCF7",     "title": "JC4697_FOXA1 IL6 MCF7" } ``` The attributes that need to be extracted are: tissue, host tissue, cell line, cell type, and disease.  Let's go through the input data to find these attributes:  1. Tissue - There is no direct mention of a tissue in the given data. Therefore, we cannot include "tissue" attribute in the output JSON. 2. Host Tissue - Since there is no mention of a tissue from which content was collected, we cannot include "host tissue" attribute in the output JSON. 3. Cell Line - The "source\_name" attribute indicates that this sample is derived from the MCF7 cell line. Therefore, we can include "cell\_line" attribute in the output JSON with value "MCF7". 4. Cell Type - The "cell type" attribute already provides the required information about the cell type of the sample. Therefore, we can include "cell\_type" attribute in the output JSON with value "Breast cancer". 5. Disease - There is no mention of any disease in the given data. Therefore, we cannot include "disease" attribute in the output JSON.  Therefore, the output JSON-formatted data will be: ```json {     "cell_line": "MCF7",     "cell_type": "Breast cancer" } ```
SAMN11091635	 Based on the provided JSON data, here is the information to be extracted and the resulting JSON output:  Information to extract:  1. tissue: The value for the "tissue" key is "liver". 2. host tissue: The value for the "source\_name" key is "Liver", which indicates that this sample is considered to be a tissue section or a whole tissue. Therefore, there is no need to extract the "host tissue" information. 3. cell line: There is no information in the input data about a cell line. 4. cell type: There is no information in the input data about a specific type of cell. 5. disease: There is no information in the input data about a disease.  Resulting JSON output: ```json {   "tissue": "liver" } ```
SAMN11101393	 Sure, I will extract the required information step by step.  1. tissue: The sample is not explicitly described as a tissue section or a whole tissue. However, since the `source_name` is HCC (hepatocellular carcinoma), which is a type of liver cancer, we can infer that the tissue is "liver". 2. host tissue: There is no information in the input data indicating that this sample is content collected from a tissue. 3. cell line: The sample is described as "Hep3B", which is a well-known human hepatocellular carcinoma (liver cancer) cell line. So, we can extract `"cell_line": "Hep3B"`. 4. cell type: The sample is described as "Liver cancer cell". This information refers to the derived or differentiated cell rather than the origin of the sample. Therefore, we can extract `"cell_type": "Liver cancer cell"`. 5. disease: Since the sample is derived from a patient with liver cancer, we can extract `"disease": "liver cancer"`.  Therefore, the output JSON-formatted data will be: ```json {   "tissue": "liver",   "cell_line": "Hep3B",   "cell_type": "Liver cancer cell",   "disease": "liver cancer" } ```
SAMN11962331	 Sure, I will extract the required information step by step.  1. tissue: The value for this attribute is already given in the input as `"tissue": "OCI-AML3 cells"` since OCI-AML3 cells are a type of tissue. 2. host tissue: There is no information about any content collected from a tissue, so there will be no `host tissue` attribute in the output. 3. cell line: Since the input contains `"source_name": "OCI-AML3 cells"` and OCI-AML3 is a name of a commonly used cell line, the value for this attribute is `"cell_line": "OCI-AML3"`. 4. cell type: The value for this attribute can be found in the `source_name` field as `"cell_type": "OCI-AML3 cells"` since OCI-AML3 cells are a type of cell. 5. disease: There is no information about any disease of the organism, so there will be no `disease` attribute in the output.  So, my final output JSON would look like this: ```json {   "tissue": "OCI-AML3 cells",   "cell_line": "OCI-AML3",   "cell_type": "OCI-AML3 cells" } ```
SAMN12147637	 Sure, I will think step by step to extract the required information:  1. tissue: There is no mention of a tissue in the input data. Therefore, there will be no "tissue" attribute in the output JSON. 2. host tissue: There is also no mention of a host tissue in the input data. Therefore, there will be no "host tissue" attribute in the output JSON. 3. cell line: The input data mention a cell line named "Embryonic stem cell and NT2 cell line". Therefore, the output JSON will include `"cell_line": "Embryonic stem cell and NT2 cell line"`. 4. cell type: The input data mention a cell type named "Embryonic stem cell and NT2 cell line". Therefore, the output JSON will include `"cell_type": "Embryonic stem cell and NT2 cell line"`. 5. disease: There is no mention of a disease in the input data. Therefore, there will be no "disease" attribute in the output JSON.  The final output JSON will be: ```json {   "cell_line": "Embryonic stem cell and NT2 cell line",   "cell_type": "Embryonic stem cell and NT2 cell line" } ```
SAMN12562981	 Based on the provided JSON data, I will extract and output the relevant information as follows: ```json {   "tissue": "Appendix" } ``` Explanation of the extracted information:  * The sample is considered to be a tissue section or whole tissue because it has the key "tissue" with the value "Appendix". * There are no keys for "host tissue", "cell line", "cell type", or "disease", so these are not included in the output.  The final output JSON-formatted data only includes the extracted information, which is: ```json {   "tissue": "Appendix" } ```
SAMN12574710	 Sure! Let's go through the input data step by step:  1. tissue: The input data contains a "tissue" attribute with the value "prostate". This indicates that the sample is a prostate tissue section or a whole prostate tissue. We will include this in our output as `"tissue": "prostate"`. 2. host tissue: There is no information about a content collected from a tissue, so we will not include "host tissue" attribute in our output. 3. cell line: The input data contains a "cell line" attribute with the value "LNCaP". This indicates that the sample is a LNCaP cell line. We will include this in our output as `"cell_line": "LNCaP"`. 4. cell type: There is no information about a specific type of cell, so we will not include "cell\_type" attribute in our output. 5. disease: There is no information about a disease of the organism the sample derived, so we will not include "disease" attribute in our output.  Therefore, based on the input data, our output JSON-formatted data would be: ```json {   "tissue": "prostate",   "cell_line": "LNCaP" } ```
SAMN12661523	 Here are the steps I would follow to extract the required information from this JSON data:  1. `tissue`: The input data already includes a `tissue` attribute, which describes the sample as "cultured human iPSC-derived neurons at ~DIV16". I can output this value as is: ```json "tissue": "cultured human iPSC-derived neurons at ~DIV16" ```  2. `host tissue`: The input data does not mention a host tissue, so there is no need to include this attribute in the output. 3. `cell line`: The input data does not mention a cell line, so there is no need to include this attribute in the output. 4. `cell type`: The input data describes the sample as "cultured human iPSC-derived neurons at ~DIV16". This means that the cells have differentiated from iPS cells into neurons. Therefore, I will extract "neuron" and include it in the output as follows: ```json "cell_type": "neuron" ``` 5. `disease`: The input data does not mention a disease associated with this sample, so there is no need to include this attribute in the output.  The final output JSON-formatted data would be: ```json {   "tissue": "cultured human iPSC-derived neurons at ~DIV16",   "cell_type": "neuron" } ```
SAMN12706244	 To extract the required information from the given JSON data, I will perform the following steps: 1. Check if the sample is a tissue section or whole tissue and extract the tissue name. In this case, the sample is not a tissue but rather white blood cells (WBCs), so there is no tissue attribute to extract. 2. Check if the sample is content collected from a tissue. The given data mentions that the sample is WBCs, which are not content collected from a tissue, so there is no host tissue attribute to extract. 3. Check if the sample is a cell line. The given data includes a "cell type" field with the value "WBC". However, this does not refer to a specific cell line name. Therefore, there is no cell\_line attribute to extract. 4. Check if the sample is a specific type of cell. In this case, the given data includes a "cell type" field with the value "WBC", which refers to white blood cells. Therefore, the output JSON will include the "cell\_type" attribute with the value "WBC". 5. Check if the input data mention a disease of the organism the sample derived. The given data does not mention any disease associated with the WBCs or the organism they were derived from. Therefore, there is no disease attribute to extract.  The output JSON will include only the following attribute: ```json {     "cell_type": "WBC" } ```
SAMN12757134	 Based on the given JSON data, I will extract the following information:  * The sample is a cell line. * The name of the cell line is NCI-H520. * The sample is a type of lung squamous cell carcinoma (LUSC) cell lines. However, since the output is supposed to describe a specific cell line name and not a general description, I will only include "NCI-H520" in the "cell\_line" attribute. * The tissue information cannot be determined as it is not specified whether NCI-H520 cells are derived from a tissue section or a whole tissue. * There is no information about the host tissue since the sample is a cell line and not content collected from a tissue. * Since there is no mention of a disease in the input data, I will not include the "disease" attribute in my output JSON.  My output JSON: ```json {   "cell_line": "NCI-H520" } ```
SAMN12773925	 This sample is a cell line, with the name "T47D" (based on the "cell line" and "source\_name" attributes). The cell type is specified as "Mammary gland ductal carcinoma epithelial cells derived from metastatic site," which can be simplified to just "carcinoma cells" for the purpose of the "cell\_type" attribute. There is no mention of a disease associated with this sample, so we will not include a "disease" attribute in our output JSON.  Output: ```json {   "cell_line": "T47D",   "cell_type": "carcinoma cells" } ```
SAMN13528410	 Sure, I will extract the required information step by step.  1. Tissue: The sample is not considered to be a tissue section or a whole tissue. So, there is no "tissue" attribute in the output JSON. 2. Host Tissue: There is no information about any content collected from a tissue. Therefore, there is no "host tissue" attribute in the output JSON. 3. Cell Line: The sample is considered to be a cell line. So, I will include `"cell_line": "hTERT RPE-1"` in the output JSON. 4. Cell Type: The sample is not considered to be a specific type of cell. Therefore, there is no "cell\_type" attribute in the output JSON. 5. Disease: There is no information about any disease of the organism the sample derived. Therefore, there is no "disease" attribute in the output JSON.  Output JSON will be: { "cell\_line": "hTERT RPE-1" }
SAMN14247827	 Sure, I will extract the required information step by step:  1. Tissue: The JSON data does not mention any tissue name, so there is no tissue attribute in the output. 2. Host tissue: There is no information about a host tissue in the given data, so this attribute is also not included in the output. 3. Cell line: The sample is a "H9-KN2 human embryonic stem cell line", which is mentioned twice in the JSON data, so the output will include `"cell_line": "H9-KN2 human embryonic stem cell line"`. 4. Cell type: The sample consists of "embryonic stem cells", as per the JSON data. Therefore, the output will include `"cell_type": "embryonic stem cells"`. 5. Disease: There is no mention of any disease in the given data, so there will be no disease attribute in the output.  Putting it all together, the output JSON-formatted data is: ```json {   "cell_line": "H9-KN2 human embryonic stem cell line",   "cell_type": "embryonic stem cells" } ```
SAMN14739068	 Sure. I will step through the process of extracting and formatting the requested information from the provided JSON data: ```json {   "accession": "SAMN14739068",   "age": "77",   "alternate_id": "PDAC_68",   "assayed_molecule": "cell-free DNA",   "organism": "Homo sapiens",   "source_name": "PDAC",   "stage": "IV",   "tissue": "PDAC" } ``` 1. Tissue: The provided data includes a `tissue` field with the value `PDAC`. Therefore, the output JSON should include a `"tissue": "PDAC"` key-value pair. 2. Host tissue: There is no information about the host tissue from which the sample was collected. Therefore, the output JSON will not include a `host_tissue` attribute. 3. Cell line: The provided data does not indicate that this sample is a cell line, so there is no need to include a `cell_line` attribute in the output JSON. 4. Cell type: Similarly, the provided data does not indicate that this sample is a specific type of cell, so there is no need to include a `cell_type` attribute in the output JSON. 5. Disease: The provided data mentions that this sample is from a patient with stage IV PDAC (pancreatic ductal adenocarcinoma), which is a type of cancer. Therefore, the output JSON should include a `"disease": "PDAC"` key-value pair.  Based on these extractions, the final output JSON will be: ```json {   "tissue": "PDAC",   "disease": "PDAC" } ```
SAMN15032605	 Based on the input data, I would output: ```json {   "tissue": "prostate" } ``` Explanation for each attribute:  1. tissue: The sample is considered to be a tissue section, with the source name including the term "prostate tissue". Therefore, I extract the tissue name "prostate" from the source name and include it in the output JSON with the "tissue" attribute. 2. host tissue: There is no information about content collected from a tissue, so this attribute is not included in the output. 3. cell line: There is no information about a cell line being used, so this attribute is not included in the output. 4. cell type: There is no information about a specific type of cell, so this attribute is not included in the output. 5. disease: There is no information about any disease related to the sample, so this attribute is not included in the output.  Note that for the tissue attribute, I extracted the word "prostate" from the source name and changed it to lowercase. This is because the term "tissue" in the source name may refer to a general type of sample rather than a specific anatomical location. Additionally, I removed the word "localized" as it is not relevant to the tissue identification.
SAMN15192175	 Based on the given JSON-formatted data, here are the attributes I can extract:  * The sample is a "cell line" and its name is "HCT116". So, the output should include `"cell_line": "HCT116"`. * The sample is also described as "colorectal carcinoma", which refers to the cell type. Therefore, the output should include `"cell_type": "colorectal carcinoma"`.  Putting it all together, the resulting JSON-formatted data I would output are: ```json {   "cell_line": "HCT116",   "cell_type": "colorectal carcinoma" } ``` Note that there is no mention of tissue or host tissue in the input data, so those attributes are not included. Similarly, there is no information about a disease associated with the sample, so the "disease" attribute is also excluded.
SAMN15913618	 Based on the given JSON data, here are the steps I would take to extract the required information:  1. Tissue: The input data does not mention whether the sample is a tissue section or a whole tissue, so I cannot provide this information. 2. Host Tissue: Similarly, the input data does not specify whether the sample is collected from a tissue, so I cannot provide this information. 3. Cell Line: The input data does not indicate that the sample is a cell line, so I cannot provide this information. 4. Cell Type: The input data already contains the cell type information as "CD27- B cell", so my output will include `"cell_type": "CD27- B cell"`. 5. Disease: There is no mention of a disease associated with the sample, so I cannot provide this information.  Therefore, based on the given data, my output JSON would be: ```json {   "cell_type": "CD27- B cell" } ```
SAMN15915146	 Based on the given JSON-formatted data, here are the attributes I can extract: 1. tissue - The attribute "tissue" is already present in the input data and has a value of "cell line". 2. cell line - Since the sample is explicitly referred to as a "cell line", we will include this in the output with the value "SW480". 3. host tissue - There is no mention of the sample being collected from a specific tissue, so there is no information to extract for this attribute. 4. cell type - The input data does not specify what type of cell the sample (cell line) is, so there is no information to extract for this attribute. 5. disease - There is no mention of any disease associated with the sample or organism, so there is no information to extract for this attribute. Therefore, the output JSON-formatted data would be: ```json {   "tissue": "cell line",   "cell_line": "SW480" } ```
SAMN17717324	 The given JSON data contains information about a sample with accession number SAMN17717324. The sample was obtained from a human organism (Homo sapiens). There is no mention of tissue, host tissue, cell line, cell type, or disease in the provided data. Therefore, the output JSON will not include any of these attributes: ```json {} ```
SAMN17727036	 Sure. I will extract the relevant information step by step as requested:  1. tissue: The sample is considered to be a specific type of cells, namely monocytes and dendritic cells. Therefore, I will include `"tissue": "monocytes and dendritic cells"` in my output JSON. 2. host tissue: There is no information about the content collected from a tissue, so there is no need to include `"host tissue"` in my output JSON. 3. cell line: There is no information about a cell line used for this sample, so there is no need to include `"cell_line"` in my output JSON. 4. cell type: The sample is considered to be monocytes and dendritic cells, which are specific types of cells. Therefore, I will include `"cell_type": "monocytes and dendritic cells"` in my output JSON. 5. disease: There is no information about the disease of the organism the sample derived, so there is no need to include `"disease"` in my output JSON.  The final output JSON is: ```json {     "tissue": "monocytes and dendritic cells",     "cell_type": "monocytes and dendritic cells" } ```
SAMN17797751	 The input data contains information about a sample used in a bulk ATAC-seq assay. Here are the steps to extract the required information and output it in JSON format:  * Tissue: There is no explicit mention of the tissue from which the cells were obtained. However, since the sample was obtained from cryopreserved peripheral blood mononuclear cells (PBMCs), we can assume that the tissue is "peripheral blood". Therefore, the output JSON will include `"tissue": "peripheral blood"`. * Host tissue: Not applicable as the sample is not content collected from a tissue. * Cell line: There is no mention of a cell line, so the output JSON will not include a "cell\_line" attribute. * Cell type: The sample is obtained from CD11c+ conventional dendritic cells (cDCs), so the output JSON will include `"cell_type": "CD11c+ cDCs"`. * Disease: There is no mention of any disease associated with the sample, so the output JSON will not include a "disease" attribute.  The final output JSON will be: ```json {   "tissue": "peripheral blood",   "cell_type": "CD11c+ cDCs" } ```
SAMN18105890	 Based on the given JSON data, here are the extracted information:  * The sample is a cell line, and its name is "CAL-120" (`"cell line": "CAL-120"`). * The cells are from a human (`"organism": "Homo sapiens"`), and they are cancerous breast cells (`"source_name": "breast cancer cells"`). This information can be used to infer the tissue type as breast tissue. * The disease is breast cancer, which can be inferred from `"source_name": "breast cancer cells"`.  The resulting JSON-formatted data are: ```json {   "cell_line": "CAL-120",   "tissue": "breast",   "disease": "breast cancer" } ``` Note that the `"host tissue"` attribute is not included because there is no explicit information about a tissue from which content was collected.
SAMN19108931	 Based on the given JSON data, I will extract information for the attributes: "cell\_line".  Here are the steps I would follow to extract this information:  1. Look for a key-value pair with the key "cell line" in the JSON data. 2. If the key "cell line" exists, then its value is the name of the cell line and should be extracted as the value for the attribute "cell\_line".  Applying these steps to the given JSON data:  * The key-value pair with the key "cell line" has a value of "MM1.S", which is the name of the cell line.  Therefore, my output will be: `{"cell_line": "MM1.S"}`
SAMN19405595	 Here are the steps I would follow to extract the required information from the given JSON data:  1. Tissue: The given JSON data does not specify whether the sample is a tissue section or a whole tissue, so I cannot include the "tissue" attribute in my output JSON. 2. Host tissue: There is no information about the content of a tissue being used as a sample in the given JSON data, so I cannot include the "host tissue" attribute in my output JSON. 3. Cell line: The given JSON data does not specify that the sample is a cell line, so I cannot include the "cell\_line" attribute in my output JSON. 4. Cell type: The given JSON data specifies that the sample is of type "Retinal Pigmented Epithelial", so I will include the "cell\_type" attribute with a value of "Retinal Pigmented Epithelial" in my output JSON. 5. Disease: The given JSON data does not mention any disease associated with the organism that the sample was derived from, so I cannot include the "disease" attribute in my output JSON.  Here is the output JSON that I would create based on the above information: ```json {   "cell_type": "Retinal Pigmented Epithelial" } ```
SAMN19514130	 Based on the given JSON-formatted data, I will extract the required information step by step.  1. tissue: The input data does not specify whether this sample is a tissue section or a whole tissue; therefore, there is no tissue name to include in the output. 2. host tissue: There is no information about a tissue from which content was collected for this sample; therefore, there is no host tissue name to include in the output. 3. cell line: The input data does not mention any cell line information; therefore, there is no cell line to include in the output. 4. cell type: According to the given JSON-formatted data, the "cell type" attribute is present and has a value of "human embryo"; therefore, I will include this in the output as `"cell_type": "human embryo"`. 5. disease: The input data does not mention any disease information; therefore, there is no disease to include in the output.  The final JSON-formatted output is: ```json {   "cell_type": "human embryo" } ```
