SAMN06122380	 Based on the provided JSON data, I can extract and output the following information: ```json {   "cell_line": "A549" } ``` Explanation of the extraction process:  1. Tissue: The input data does not mention any tissue that the sample is a section or a whole tissue, so there is no need to include this information in the output JSON. 2. Host tissue: The input data does not mention any content collected from a tissue, so there is no need to include this information in the output JSON. 3. Cell line: The input data mentions that the sample is a "Homo sapiens A549 immortalized cell line treated with 100 nM dexamethasone for 1 hour", so we can extract `"cell_line": "A549"` from this information. 4. Cell type: The input data mentions that the sample is a "Homo sapiens A549 immortalized cell line treated with 100 nM dexamethasone for 1 hour", but it does not specify what type of cells are in this cell line, so there is no need to include this information in the output JSON. 5. Disease: The input data does not mention any disease associated with the sample, so there is no need to include this information in the output JSON.
SAMN06207638	 Based on the input data, I would output the following JSON: ``` {   "host tissue": "blood" } ``` Explanation:  1. The sample is considered to be a specific type of cell (`"cell type": "blood serum"`). This means that we should include the `"cell_type"` attribute in the output JSON. 2. Since blood serum is not a tissue, but rather a fluid that can be obtained from blood, it does not make sense to include the `"tissue"` attribute in the output JSON. 3. There is no information about a cell line or disease in the input data, so we do not include these attributes in the output JSON. 4. Since blood serum is a fluid that can be obtained from blood, and blood is a tissue, it makes sense to include the `"host tissue"` attribute in the output JSON with the value of "blood".
SAMN06294926	 Sure, I will extract the required information step by step from the given JSON data:  1. tissue - Not mentioned in the input data. So, it won't be included in the output. 2. host tissue - Not mentioned in the input data. So, it won't be included in the output. 3. cell line - Mentioned in the input data as "SKmel239". So, it will be included in the output JSON with the "cell\_line" attribute. 4. cell type - Not mentioned in the input data. So, it won't be included in the output. 5. disease - Not mentioned in the input data. So, it won't be included in the output.  The output JSON will be: ```json {   "cell_line": "SKmel239" } ```
SAMN06614011	 Sure. Here is the step-by-step analysis for the given JSON data:  * The "tissue" attribute in input data is "CD34+ Bone Marrow". Therefore, my output will include `"tissue": "bone marrow"` since it's a tissue section. * There is no "host tissue" attribute in input data, so I won't include it in the output. * The "cell type" attribute is present and has the value "CMP". Therefore, my output will include `"cell_type": "CMP"`. * There is no "cell\_line" attribute, so I won't include it in the output. * There is no "disease" attribute, so I won't include it in the output.  Here's the final JSON-formatted output: ```json {   "tissue": "bone marrow" } ``` Note that this output only includes the attributes for which we have information.
SAMN06657641	 Sure. Here are the steps I would take to extract the relevant information from the given JSON data:  1. **Tissue:** The input data already includes a "tissue" field with the value "frontal cortex", so I can use that for my output. 2. **Host tissue:** There is no indication in the input data that this sample is content collected from another tissue, so I do not need to include a "host tissue" field in my output. 3. **Cell line:** The input data does not mention any cell lines, so I do not need to include a "cell\_line" field in my output. 4. **Cell type:** There is no indication in the input data that this sample is a specific type of cell, so I do not need to include a "cell\_type" field in my output. 5. **Disease:** The input data does not mention any disease associated with this sample, so I do not need to include a "disease" field in my output.  Based on the above steps, the relevant information extracted from the input data is: ```json {   "tissue": "frontal cortex" } ```
SAMN06685660	 Based on the given JSON data, here are the extracted information:  * The sample is a cell line. The name of the cell line is "human embryonic stem cells". Therefore, the output should include `"cell_line": "human embryonic stem cells"`. * The specific type of this cell line is "human embryonic stem cells". However, since it's already described as a cell line, there is no need to repeat it. Therefore, we don't add `"cell_type": "human embryonic stem cells"`. * There is no information about the tissue or organ where this sample was obtained. Therefore, we don't add "tissue" or "host tissue". * The cell line is called "H9", which can be added as `"source_name": "H9"`. * There is no mention of a disease in this data. Therefore, we don't add the "disease" attribute.  The final output should look like: ```json {   "cell_line": "human embryonic stem cells",   "source_name": "H9" } ```
SAMN06710586	 Sure, I will extract the required information step by step from the input JSON data: ```json {   "accession": "SAMN06710586",   "cell_line": "GM12878",   "organism": "Homo sapiens",   "source_name": "GM12878",   "title": "ChIP-seq for BATF3 [SL140322]" } ``` 1. Tissue: There is no information about the tissue in the input data, so I will not include it in the output JSON. 2. Host Tissue: There is also no information about the host tissue, so I will not include it in the output JSON. 3. Cell Line: The cell line name "GM12878" is provided in the input data, so I will include it in the output JSON as follows: `"cell_line": "GM12878"` 4. Cell Type: There is no information about the cell type in the input data, so I will not include it in the output JSON. 5. Disease: The organism associated with the sample is "Homo sapiens", but there is no mention of any disease that the sample may have come from. Therefore, I will not include a `"disease"` attribute in the output JSON.  So, my final output JSON would be: ```json {   "cell_line": "GM12878" } ```
SAMN07419514	 Sure, I will extract the required information step by step:  1. tissue: The `source_name` attribute in the input data is "HCT116". After doing a quick search, I found out that HCT116 is a colon cancer cell line derived from human colon tissue. Therefore, my output will include `"tissue": "colon"`. 2. host tissue: Since the sample is a cell line, there is no need to extract and include the "host tissue" attribute in the output JSON. 3. cell line: As mentioned earlier, the `source_name` attribute in the input data is "HCT116". Therefore, my output will include `"cell_line": "HCT116"`. 4. cell type: The `source_name` attribute in the input data is "HCT116", which is a colon cancer cell line. Hence, my output will include `"cell_type": "cancer cells"`. 5. disease: Since the sample is a cell line derived from a human colon tissue, there is no information about any disease associated with the organism the sample derived from. Therefore, I will not include the "disease" attribute in my output JSON.  My output JSON format will be as follows: ```json {   "tissue": "colon",   "cell_line": "HCT116",   "cell_type": "cancer cells" } ```
SAMN07503510	 Based on the given JSON data, I will extract the required information step by step:  1. tissue: The value for this attribute is already provided in the input data as `"tissue": "Human kidney cancer cell line HEK293T"`. So, the output will include the attribute `"tissue": "Human kidney cancer cell line HEK293T"`. 2. host tissue: The given sample is a cell line and not content collected from a tissue. Therefore, there is no need to include the "host tissue" attribute in the output. 3. cell line: The value for this attribute is already provided in the input data as `"cell line": "HEK293T"`. So, the output will include the attribute `"cell_line": "HEK293T"`. 4. cell type: The given sample is a cell line and not a specific type of cell. Therefore, there is no need to include the "cell\_type" attribute in the output. 5. disease: There is no information about any disease related to the organism from which the sample was derived. Therefore, there is no need to include the "disease" attribute in the output.  So, the final output JSON will be: ```json {   "tissue": "Human kidney cancer cell line HEK293T",   "cell_line": "HEK293T" } ```
SAMN08114531	 Step 1: Determine the tissue The input data includes a "tissue" field with the value "primary osteosarcoma tumor". I will extract this information as the tissue type.  Step 2: Determine the host tissue The input data does not specify if the sample is a section of tissue or content collected from a tissue, so there is no information to extract for the host tissue.  Step 3: Determine the cell line The input data does not indicate that the sample is a cell line, so I will not include any information about a cell line in the output.  Step 4: Determine the cell type The input data does not specify the type of cells in the sample, so I will not include any information about the cell type in the output.  Step 5: Determine the disease The input data indicates that the sample is a "primary osteosarcoma tumor", which suggests that the organism from which the sample was derived had osteosarcoma. I will include this information in the output as the disease.  Output JSON:  { "tissue": "primary osteosarcoma tumor", "disease": "osteosarcoma" }
SAMN08122655	 Sure. I will extract information from the given JSON data step by step as follows:  1. tissue    The sample is not considered to be a tissue section or a whole tissue, so there is no tissue name to extract and include in the output JSON. 2. host tissue   The sample is a cell line, so it is not content collected from a tissue. Therefore, I do not need to include a "host tissue" attribute in my output JSON. 3. cell line   The sample is explicitly described as "SK-N-BE(2)c", which is a name of a cell line. So, I will include `"cell_line": "SK-N-BE(2)c"` in my output JSON. 4. cell type   The sample is described as "Neuroblastoma cells". However, this is a description of the cell line SK-N-BE(2)c and not a specific type of cell. So, I will not include a "cell\_type" attribute in my output JSON. 5. disease   There is no mention of any disease in the input data. Therefore, I will not include a "disease" attribute in my output JSON.  Based on the above extraction, my final output JSON-formatted data are: ```json {     "cell_line": "SK-N-BE(2)c" } ```
SAMN08144987	 Sure, I will extract the relevant information step by step. 1. tissue: The input data does not provide enough information about the sample being a tissue section or a whole tissue, so I cannot include it in the output JSON. 2. host tissue: There is no mention of the sample being content collected from a tissue, so I will not include "host tissue" in the output JSON. 3. cell line: The input data clearly states that the sample is a primary cell type, which means it was not cultured and therefore cannot be a cell line. So, I will not include "cell\_line" in the output JSON. 4. cell type: The input data already includes this information as "Memory T cell", so I will include it in the output JSON as `"cell_type": "Memory T cell"`. 5. disease: Although the input data mentions "disease status" and its value is "healthy", there is no mention of a specific disease, so I will not include "disease" in the output JSON.  So, the final output JSON is: ```json {   "cell_type": "Memory T cell" } ```
SAMN08172110	 Sure, here are the steps I would take to extract the relevant information from this JSON data:  1. Tissue - There is no mention of a tissue in this data, so we will not include the "tissue" attribute in our output. 2. Host Tissue - There is also no mention of a host tissue in this data, so we will not include the "host tissue" attribute in our output. 3. Cell Line - The sample is considered to be a cell line, and its name is "CRL7250 (fibroblast)". We will include the "cell\_line" attribute in our output with this value. 4. Cell Type - There is no mention of a specific cell type in this data, so we will not include the "cell\_type" attribute in our output. 5. Disease - There is also no mention of a disease associated with this sample, so we will not include the "disease" attribute in our output.  Based on these extractions, here is the final JSON-formatted data that we would output: ```json {   "cell_line": "CRL7250 (fibroblast)" } ```
SAMN08243228	 Based on the input data, I would output the following JSON: ```json {   "cell_line": "HEK293" } ``` This is because the input data clearly indicates that the sample is a cell line, and the name of the cell line is provided as "HEK293". None of the other attributes (tissue, host tissue, cell type, or disease) are mentioned in the input data.
SAMN08454671	 1. tissue: The input data does not mention if the sample is a tissue section or whole tissue, so there is no tissue attribute in the output JSON. 2. host tissue: There is no information about the content of a tissue being used as a sample, so there is no "host tissue" attribute in the output JSON. 3. cell line: The input data clearly states that the sample is a "HeLa" cell line, so the output JSON will include `"cell_line": "HeLa"`. 4. cell type: Although HeLa cells are derived from human cells (Homo sapiens), they have undergone transformation and no longer represent a specific cell type. Therefore, there is no "cell\_type" attribute in the output JSON. 5. disease: The input data does not mention any disease associated with the sample, so there is no "disease" attribute in the output JSON.  The resulting JSON output would be: ```json {   "cell_line": "HeLa" } ```
SAMN08772104	 Based on the provided JSON data, I will extract the required information step by step.  1. tissue: The given data does not provide information about the tissue from which the sample was collected. Hence, there is no "tissue" attribute in my output. 2. host tissue: There is also no mention of a host tissue for this sample. Therefore, I will not include a "host\_tissue" attribute. 3. cell line: The given data already includes information about the cell line, which is `GM12878`. So, my output will have the `"cell_line": "GM12878"` attribute. 4. cell type: The sample's cell type can be inferred from the cell line name since GM12878 cells are B lymphocytes (a type of white blood cell). Therefore, my output will include `"cell_type": "B lymphocyte"`. 5. disease: There is no information about a disease related to this sample in the provided data. Hence, I will not include a "disease" attribute.  My final JSON-formatted output is: ```json {   "cell_line": "GM12878",   "cell_type": "B lymphocyte" } ```
SAMN08772417	 Based on the given JSON data, I will extract the required information step by step:  1. tissue: The data does not specify if the sample is a tissue section or a whole tissue, so I cannot provide this information. 2. host tissue: The data does not mention any content collected from a tissue, so I cannot provide this information. 3. cell line: The JSON data already provides the cell line name as "K562 cells", so it will be included in the output with the "cell\_line" attribute. 4. cell type: The given data mentions that the sample is a "K562 cells", and I cannot find any information about differentiated cells, so I will include "cell\_type": "K562 cells". 5. disease: There is no mention of any disease related to the organism from which the sample was derived, so I cannot provide this information.  My output JSON format will be as follows: ```json {   "cell_line": "K562 cells",   "cell_type": "K562 cells" } ```
SAMN09237962	 Based on the provided JSON data, here is the extracted information:  * The sample is a tissue section or a whole tissue, and the tissue name is "Preimplantation embryo". * The sample is not considered to be content collected from a tissue. * The sample is not a cell line. * The sample is a specific type of cell, and the cell type name is "zygote". * The sample does not have any mention of disease.  Here is the output JSON: ```json {   "tissue": "Preimplantation embryo",   "cell_type": "zygote" } ```
SAMN09255036	 Sure. Here are the steps I would take to extract and structure the information from this JSON data:  1. Tissue: The input data does not explicitly mention a tissue or a tissue section, so I will not include a "tissue" attribute in my output. 2. Host tissue: Similarly, the input data does not indicate that this sample is content collected from a tissue, so I will not include a "host tissue" attribute in my output. 3. Cell line: The input data also does not mention a cell line, so I will not include a "cell\_line" attribute in my output. 4. Cell type: The input data mentions the sample as "CRC", which is short for colorectal cancer. This suggests that the sample is a specific type of cell, namely a cancerous cell from the colon or rectum. I will include a "cell\_type" attribute in my output with the value "colorectal cancer cell." 5. Disease: The input data already includes a "disease" attribute with the value "Carcinoma," which is another term for cancer. This suggests that the sample was collected from an organism affected by cancer. I will include this information in my output as-is, so the final JSON object looks like this: ```json {   "cell_type": "colorectal cancer cell",   "disease": "Carcinoma" } ``` This is just one possible interpretation of the input data. Depending on the context and additional information, there might be other valid ways to structure this data.
SAMN09371850	 Sure, I will extract the relevant information step by step from the provided JSON data:  1. The sample is not considered to be a tissue section or a whole tissue, so there is no tissue attribute in the output. 2. The sample is a cell line and its name is "MV4:11", so I will include this information in the output as `"cell_line": "MV4:11"`. 3. There is no information about a specific type of cell, so there is no "cell\_type" attribute in the output. 4. The data do not mention any disease of the organism the sample derived, so there is no "disease" attribute in the output.  Therefore, my output JSON-formatted data are: ```json {     "cell_line": "MV4:11" } ```
SAMN09492319	 Sure, I will extract the relevant information step by step. 1. tissue: The input data does not provide enough information to determine if the sample is a tissue section or whole tissue, so I cannot include a "tissue" attribute in my output. 2. host tissue: There is no mention of the sample being content collected from a tissue, so I will not include a "host tissue" attribute. 3. cell line: The input data does not indicate that this sample is a cell line, so I will not include a "cell\_line" attribute. 4. cell type: The input data explicitly names the cell type as "Primary epidermal keratinocyte," so I will include `"cell_type": "Primary epidermal keratinocyte"` in my output. 5. disease: There is no mention of a disease associated with this sample, so I will not include a "disease" attribute. Therefore, my final output JSON-formatted data would be: ```json {   "cell_type": "Primary epidermal keratinocyte", } ```
SAMN09492334	 Sure. I will first check if the input data contains information about the tissue, host tissue, cell line, cell type, and disease.  * Tissue: There is no information about a tissue in the input data. * Host tissue: There is no information about a host tissue in the input data. * Cell line: The input data mentions that the sample is a "GM12878 cell line". I will include this information in the output JSON using the "cell\_line" attribute. * Cell type: The input data mentions that the sample is a "GM12878 cell line" and also contains the attribute "cell type" with a value of "GM12878 cell line". I will include this information in the output JSON using the "cell\_type" attribute. * Disease: There is no information about a disease in the input data.  Here is the output JSON: ```json {   "cell_line": "GM12878 cell line",   "cell_type": "GM12878 cell line" } ```
SAMN09723229	  * The sample has a "cell line" attribute, which is "HeLa". This will be included in the output JSON as `"cell_line": "HeLa"`. * The "source\_name" attribute provides additional information about the sample's origin. It mentions "cervical cancer cells", but this does not meet the criteria for any of the required attributes (tissue, host tissue, cell type). Therefore, it will not be included in the output JSON. * There is no explicit "tissue" or "host tissue" attribute in the input data. However, cervical cancer is a disease that affects a specific organ, the cervix. If we make the assumption that the sample was collected from the cervix, then it can be classified as a "tissue" and the output JSON will include `"tissue": "cervix"`. * There is no "cell\_type" attribute in the input data, so this will not be included in the output JSON. * The sample was collected from a patient with cervical cancer, which is a disease. Therefore, the output JSON will include `"disease": "cervical cancer"`.  The final output JSON: ```json {     "cell_line": "HeLa",     "tissue": "cervix",     "disease": "cervical cancer" } ```
SAMN10081996	 The input data contains the following information:  1. cell line: HepG2 2. cell type: Hepatocellular carcinoma 3. chip antibody: CCAR2 (Zen BioScience Cat# 200093) 4. organism: Homo sapiens 5. source\_name: HepG2  The "cell line" and "source\_name" have the same value, which is HepG2. This indicates that the sample is a cell line. Therefore, we can extract the following information for the output JSON:  * "cell\_line": "HepG2"  Additionally, the "cell type" attribute indicates that this cell line is derived from hepatocellular carcinoma. However, since it does not mention if the cells themselves have hepatocellular carcinoma or were collected from a patient with this disease, we cannot include the "disease" attribute in the output JSON.  Therefore, the final output JSON is: ```json {     "cell_line": "HepG2" } ```
SAMN10172287	 Sure. Let's go through the data step by step to extract the required information:  1. Tissue: There is no mention of a tissue in the provided data, so we will not include this attribute in our output. 2. Host tissue: Similarly, there is no mention of a host tissue, so we will not include this attribute. 3. Cell line: Although "human pluripotent stem cell" is mentioned, it does not refer to a specific cell line name. Therefore, we will not include the "cell\_line" attribute in our output. 4. Cell type: The provided data includes the attribute "cell type" with a value of "PSC", which stands for pluripotent stem cells. Therefore, our output will include `"cell_type": "pluripotent stem cells"`. 5. Disease: There is no mention of a disease in the provided data, so we will not include this attribute in our output.  Therefore, based on the provided JSON-formatted data, the extracted information is: ```json {     "cell_type": "pluripotent stem cells" } ```
SAMN10431484	 Sure. Let's go step by step to extract the required information from the given JSON data and output it in a new JSON format.  1. tissue: There is no explicit mention of a tissue in the input data. However, sometimes the cell type can be a tissue itself, so let's check if that's the case for "LSC". According to the NCBI Glossary (<https://www.ncbi.nlm.nih.gov/home/glossary/>), LSC stands for Leukemia Stem Cell. Since leukemia affects blood cells, which do not have a specific tissue location in the body, we cannot determine a tissue from this data. Therefore, there will be no "tissue" attribute in our output JSON. 2. host tissue: There is no explicit mention of a host tissue in the input data. Since LSCs are blood cells affected by leukemia, it's not possible to identify a specific host tissue from this data. Therefore, there will be no "host tissue" attribute in our output JSON. 3. cell line: There is no explicit mention of a cell line in the input data. The sample is described as an LSC (Leukemia Stem Cell), and we cannot determine if it's part of a cell line or not based on this information. Therefore, there will be no "cell\_line" attribute in our output JSON. 4. cell type: The input data already contains the cell type information as "LSC", so that should be included in our output JSON. 5. disease: There is an explicit mention of a patient diagnosis "acute myeloid leukemia" in the input data. This information should be included in our output JSON.  Based on the extraction, our final output JSON will look like this: ```json {     "cell_type": "LSC",     "disease": "acute myeloid leukemia" } ```
SAMN10471411	 Based on the given JSON-formatted data, I will extract the required information step by step:  1. tissue - There is no mention of a tissue in the input data, so there will be no "tissue" attribute in the output JSON. 2. host tissue - Since this sample is a cell line, it does not have a host tissue; therefore, there will be no "host tissue" attribute in the output JSON. 3. cell line - The "cell line" field is present with the value "T47D", so the output JSON will include `"cell_line": "T47D"`. 4. cell type - The "cell type" field is present with the value "Breast cancer cell line". However, I only need to extract the specific cell type and not its description, so the output JSON will include `"cell_type": "breast cancer cell"` (removing 'line' from the name). 5. disease - There is no mention of a disease in the input data, so there will be no "disease" attribute in the output JSON.  The final output JSON will be: ```json {   "cell_line": "T47D",   "cell_type": "breast cancer cell" } ```
