SAMN19904672	 Sure, let me extract the required information step by step.  1. tissue The input data does not mention if the sample is a tissue section or whole tissue, so we cannot include `"tissue"` in our output JSON. 2. host tissue There is no mention of content collected from a tissue, so we cannot include `"host_tissue"` in our output JSON. 3. cell line The input data mentions that the sample is a "MSN02-4" cell line, so we will include `"cell_line": "MSN02-4"` in our output JSON. 4. cell type The input data specifies that the sample is an "hPSC-derived cardiomyocyte", which is a specific type of cell, so we will include `"cell_type": "hPSC-derived cardiomyocyte"` in our output JSON. 5. disease There is no mention of any disease related to the sample, so we cannot include `"disease"` in our output JSON.  Output JSON: ```json {   "cell_line": "MSN02-4",   "cell_type": "hPSC-derived cardiomyocyte" } ```
SAMN20109702	 Based on the given JSON data, I will extract the required information step by step:  1. tissue: The input data does not specify the tissue from which the cell line was derived. Therefore, there is no "tissue" attribute in the output. 2. host tissue: Since this sample is a cell line, it was not collected from any host tissue. Therefore, there is no "host tissue" attribute in the output. 3. cell line: The input data contains the "cell line" attribute with the value of "C4-2". Therefore, the output will include `"cell_line": "C4-2"`. 4. cell type: The input data contains the "cell type" attribute with the value of "prostate cancer cell line". Therefore, the output will include `"cell_type": "prostate cancer cell line"`. 5. disease: Although the cell line is a prostate cancer cell line, the input data does not specify if it was derived from any diseased tissue. Therefore, there is no "disease" attribute in the output.  The final output JSON will be: ```json {   "cell_line": "C4-2",   "cell_type": "prostate cancer cell line" } ```
SAMN20506434	 Here are the steps I would take to extract the required information from this JSON data:  1. tissue: There is no mention of a tissue in the provided data, so I will not include a "tissue" attribute in my output. 2. host tissue: There is also no mention of a host tissue in the data, so there will be no "host tissue" attribute in my output. 3. cell line: The "cell line" attribute is present and has the value "LNCaP", so I will include this in my output. 4. cell type: The "cell type" attribute is present and has the value "prostate cancer". Since the sample is a cell line, I will interpret this as referring to a prostate cancer cell line, rather than just any cells of that type. Therefore, my output will include `"cell_type": "prostate cancer"`. 5. disease: There is no mention of a disease in the data, so there will be no "disease" attribute in my output.  My final output JSON would be: ```json {   "cell_line": "LNCaP",   "cell_type": "prostate cancer" } ```
SAMN20810491	 Sure, I will extract the relevant information step by step:  1. The sample is not considered to be a tissue section or a whole tissue, so there is no need to include `"tissue"` attribute in the output JSON. 2. The sample is not collected from a tissue, so there is no need to include `"host tissue"` attribute in the output JSON. 3. The sample is considered to be a cell line, and its name is "K562". So I will include `"cell_line": "K562"` in the output JSON. 4. The sample is also considered to be of type "Immortalized lymphoblast", so I will include `"cell_type": "Immortalized lymphoblast"` in the output JSON. 5. There is no mention of a disease associated with this sample, so there is no need to include the `"disease"` attribute in the output JSON.  The final output JSON: ```json {     "cell_line": "K562",     "cell_type": "Immortalized lymphoblast" } ```
SAMN20867092	 Sure. Here are the steps I would take to extract the relevant information from this JSON data:  1. Tissue: The "source\_name" field contains the abbreviation "WAT," which stands for white adipose tissue. Therefore, I will include "tissue": "white adipose tissue" in my output. 2. Host tissue: There is no information about a host tissue in this data. Therefore, I will not include a "host tissue" attribute in my output. 3. Cell line: There is no information about a cell line in this data. Therefore, I will not include a "cell\_line" attribute in my output. 4. Cell type: The "cell type" field contains the string "white adipose derived mesenchymal stromal cells." Therefore, I will include "cell\_type": "white adipose derived mesenchymal stromal cells" in my output. 5. Disease: There is no information about a disease in this data. Therefore, I will not include a "disease" attribute in my output.  Here is the final JSON-formatted output: ```json {   "tissue": "white adipose tissue",   "cell_type": "white adipose derived mesenchymal stromal cells" } ```
SAMN21206972	 Sure, let's go through the input data step by step.  1. tissue: The input data contains a key "tissue" with value "T cell line with HIV-1 and ZFP3-FLAG". This is a specific type of cell, so we will use "cell line" as the attribute name instead of "tissue". 2. host tissue: There is no information about a tissue from which this sample was collected or in which it resides. Therefore, there is no need to include "host tissue" attribute in the output JSON. 3. cell line: The input data contains a key "cell line" with value "J-lat 1C10". This is a specific name of a cell line, so we will use this information for the "cell\_line" attribute. 4. cell type: Since the value of "tissue" attribute ("T cell line with HIV-1 and ZFP3-FLAG") is a specific type of cell, we can use it for the "cell\_type" attribute. 5. disease: There is no information about any disease related to this sample in the input data. Therefore, there is no need to include "disease" attribute in the output JSON.  Based on the above extraction, the output JSON will be: ```json {     "cell_line": "J-lat 1C10",     "cell_type": "T cell line with HIV-1 and ZFP3-FLAG" } ```
SAMN21214668	 The input JSON data does not contain information about the tissue, host tissue, cell line, cell type, or disease. Therefore, I will not include those attributes in my output.  Here is the output JSON: ```json {     "accession": "SAMN21214668",     "broker name": "NCBI",     "common name": "human",     "organism": "Homo sapiens",     "title": "GEO accession GSM5555061 is currently private and is scheduled to be released on Mar 01, 2023." } ```
SAMN22081917	 Sure, let's go through the steps to extract the required information from the given JSON data.  1. Tissue: There is no tissue name mentioned in the input data, so we will not include it in our output. 2. Host Tissue: There is also no mention of a host tissue in the input data. 3. Cell Line: The input data contains the attribute "cell line" with the value "PGP1", which is a specific cell line name. So, we will include this in our output. 4. Cell Type: Although the cell line "PGP1" was derived from iPS cells, it has been differentiated into a specific type of cell. However, the given data does not provide information on what type of cell it is. Therefore, we cannot include the "cell\_type" attribute in our output. 5. Disease: There is no mention of any disease related to this sample in the input data.  Here's the final JSON-formatted output based on the extracted information: ```json {   "cell_line": "PGP1" } ```
SAMN23551597	 Sure. I will extract the required information step by step:  1. tissue    The sample is not considered to be a tissue section or a whole tissue, so there is no "tissue" attribute in the output JSON. 2. host tissue    There is no mention of any content collected from a tissue, so there is no "host tissue" attribute in the output JSON. 3. cell line    The sample is not considered to be a cell line, so there is no "cell\_line" attribute in the output JSON. 4. cell type    The input data mention that the sample is "WT cardiomyocytes Day 18-20", which suggests that it is a specific type of cell. Therefore, the "cell\_type" attribute should be included in the output JSON with a value of "cardiomyocytes". 5. disease    There is no mention of any disease associated with the sample, so there is no "disease" attribute in the output JSON.  The final output JSON is: ```json {   "cell_type": "cardiomyocytes" } ```
SAMN25125233	 Here are the steps I would take to extract the required information from this JSON data:  1. Tissue: There is no mention of a tissue in the provided data, so there will be no "tissue" attribute in the output. 2. Host tissue: There is also no mention of a host tissue in the provided data, so there will be no "host tissue" attribute in the output. 3. Cell line: The data contains the key "cell type" with the value "colorectal adenocarcinoma cell lines", so there will be a "cell\_line" attribute in the output with this value. 4. Cell type: There is no mention of a specific cell type in the provided data, so there will be no "cell\_type" attribute in the output. 5. Disease: There is no mention of a disease in the provided data, so there will be no "disease" attribute in the output.  The output JSON-formatted data would be as follows: ```json {   "cell_line": "colorectal adenocarcinoma cell lines" } ```
SAMN28811549	 Sure. I will extract the required information step by step from the given JSON data: ```json {   "accession": "SAMN28811549",   "cell line": "NCI-H295R",   "cell type": "human adrenocortical carcinoma",   "organism": "Homo sapiens",   "source_name": "NCI-H295R, baseline",   "title": "27-CLP-3",   "treatment": "DMSO" } ``` 1. tissue: The input data does not provide any information about the tissue from which the sample was collected. Therefore, I will not include the `tissue` attribute in my output JSON. 2. host tissue: There is no information about the content collected from a tissue. So, I will not include the `host_tissue` attribute in my output JSON. 3. cell line: The input data mentions that the sample belongs to the NCI-H295R cell line. Therefore, I will include this information in my output JSON with the `cell_line` attribute. 4. cell type: The input data also specifies that the sample is a human adrenocortical carcinoma. This means that the cells in the sample are of a specific type, i.e., human adrenocortical carcinoma. Therefore, I will include this information in my output JSON with the `cell_type` attribute. 5. disease: The input data does not mention any disease associated with the organism from which the sample was collected. So, I will not include the `disease` attribute in my output JSON.  After extracting the required information, my output JSON is: ```json {   "cell_line": "NCI-H295R",   "cell_type": "human adrenocortical carcinoma" } ```
SAMN28827528	 Sure. Here are the steps I would take to extract the relevant information from this JSON data:  1. Tissue: There is no explicit mention of a tissue in this data, so we will not include a "tissue" attribute in our output. 2. Host Tissue: Similarly, there is no mention of a host tissue, so we will not include a "host tissue" attribute. 3. Cell Line: The cell line is explicitly mentioned as "NB4", so we will include a "cell\_line" attribute with this value in our output. 4. Cell Type: Although "Acute promyelocytic leukemia" is a disease, it appears that it is being used here to describe the type of cell. Therefore, we will include a "cell\_type" attribute with this value in our output. 5. Disease: There is no mention of a disease in this data, so we will not include a "disease" attribute.  Here is the JSON-formatted output: ```json {   "cell_line": "NB4",   "cell_type": "Acute promyelocytic leukemia" } ```
SAMN29765822	 Based on the given JSON data, I will extract the required information as follows:  * The sample is derived from a tissue, and the tissue name is "blood". Therefore, the output JSON will include `"tissue": "blood"`. * There is no mention of content collected from a tissue in the given input data. Hence, the output JSON will not include a "host tissue" attribute. * The sample is not explicitly mentioned as a cell line. Therefore, the output JSON will not include a "cell\_line" attribute. * The sample is derived from B cells, and B cells are a specific type of cell. Therefore, the output JSON will include `"cell_type": "B cells"`. * There is no mention of any disease in the given input data. Hence, the output JSON will not include a "disease" attribute.  The final output JSON will be:  ```json {   "tissue": "blood",   "cell_type": "B cells" } ```
SAMN29826781	 Here are the steps I would follow to extract and structure the information from the given JSON data:  1. Tissue: The sample is not explicitly described as a tissue section or whole tissue, so I will not include a "tissue" attribute in my output. 2. Host Tissue: There is no mention of the sample being collected from a specific tissue, so I will not include a "host tissue" attribute in my output. 3. Cell Line: The sample is described as a "Single prostate tumor cell," but it is not clear if this refers to a specific cell line. I will not include a "cell\_line" attribute in my output. 4. Cell Type: The sample is explicitly described as a "Single prostate tumor cell," so I will include `"cell_type": "prostate tumor cell"` in my output. 5. Disease: The sample is described as a "prostate tumor cell," but it does not specify the type of disease. I will not include a "disease" attribute in my output.  Based on this analysis, here is the JSON-formatted data that I would output: ```json {   "cell_type": "prostate tumor cell" } ```
SAMN30058146	 1. tissue: The input data does not mention the sample being a tissue section or a whole tissue. Therefore, I will not include the "tissue" attribute in my output JSON. 2. host tissue: There is no information about content collected from a tissue. Therefore, I will not include the "host tissue" attribute in my output JSON. 3. cell line: The input data specifies that the sample is a "H446" cell line. Therefore, I will include `"cell_line": "H446"` in my output JSON. 4. cell type: Although the cell line type is mentioned as "small cell lung cancer SCLC-N subtype", this attribute describes a specific cell line name rather than a name of a cell. Therefore, I will not include the "cell\_type" attribute in my output JSON. 5. disease: The input data does not mention any disease related to the organism the sample derived. Therefore, I will not include the "disease" attribute in my output JSON.  My output is: `{"cell_line": "H446", "genotype": "NEUROD1 knockout"}`
SAMN30348081	 Based on the given JSON-formatted data, I would extract the following information:  * The sample is a type of cell (motor neuron), so I will include `"cell_type": "motor neuron"` in my output. * The sample was derived from an organism with amyotrophic lateral sclerosis, so I will include `"disease": "amyotrophic lateral sclerosis"` in my output.  Here is the JSON-formatted data that I would output: ```json {     "cell_type": "motor neuron",     "disease": "amyotrophic lateral sclerosis" } ``` I would not include the other attributes (e.g., "accession", "age", "description", etc.) in my output because they are not relevant to the information that I am required to extract.
SAMN30444981	 Based on the given JSON data, I would extract the following information:  * The sample is considered to be a tissue section, and the tissue name is "Forebrain" (based on the value of the `tissue` attribute). * The sample is a neuron, based on the value of the `group` attribute. * The sample was collected from the Amygdaloid Complex region in the Forebrain (based on the values of the `source_name` and `tissue` attributes). * The organism that the sample was derived from is Homo sapiens, based on the value of the `organism` attribute.  I would output this information as follows: ``` {   "tissue": "Forebrain",   "cell_type": "neuron",   "host tissue": "Amygdaloid Complex" } ``` Note that I did not include the `disease` attribute, because there is no mention of a disease in the input data.
SAMN32635407	 Based on the given JSON data, I will extract the required information step by step.  1. tissue: The JSON object contains a key named "tissue" with value "retinal epithelium". Therefore, in the output JSON, we will include `"tissue": "retinal epithelium"`. 2. host tissue: There is no information about any content collected from a tissue. So, there is no need to include "host tissue" attribute in the output JSON. 3. cell line: The JSON object contains a key named "cell line" with value "hTERT RPE-1". Therefore, in the output JSON, we will include `"cell_line": "hTERT RPE-1"`. 4. cell type: The JSON object contains a key named "cell type" with value "immortalized retinal epithelial cells". Therefore, in the output JSON, we will include `"cell_type": "immortalized retinal epithelial cells"`. 5. disease: There is no mention of any disease related to the sample in the JSON data. So, there is no need to include the "disease" attribute in the output JSON.  Therefore, based on the given JSON data, the output JSON will be: ```json {   "tissue": "retinal epithelium",   "cell_line": "hTERT RPE-1",   "cell_type": "immortalized retinal epithelial cells" } ```
SAMN33214491	 Sure. Here are the steps I would take to extract and structure the relevant information from this JSON:  1. Tissue: There is no mention of a tissue in this JSON, so I will not include a "tissue" attribute in my output. 2. Host tissue: Similarly, there is no mention of a host tissue in this JSON, so I will not include a "host tissue" attribute in my output. 3. Cell line: The input JSON already includes the name of the cell line ("U2OS") as a separate key-value pair. I can extract this information and include it in my output with the "cell\_line" attribute. 4. Cell type: The input JSON also includes the cell type ("Human osteosarcoma") as a separate key-value pair. I can extract this information and include it in my output with the "cell\_type" attribute. 5. Disease: There is no mention of a disease in this JSON, so I will not include a "disease" attribute in my output.  Here is the output JSON that I would create based on these steps: ```json {   "cell_line": "U2OS",   "cell_type": "Human osteosarcoma" } ```
SAMN33943039	 To extract the required information from the given JSON data and structure it in a new JSON object, I will perform the following steps:  1. Create an empty output JSON object to store the extracted information. 2. Extract the tissue type from the "tissue" attribute of the input JSON. In this case, it is "Lung, mesothelioma". Since this sample is considered to be a tissue section (not the content of a tissue), we include it in the output JSON with the "tissue" attribute. 3. Extract any information related to host tissue from the input JSON. However, the given data does not mention any other tissue from which the sample was collected. Therefore, no "host tissue" attribute will be added to the output JSON. 4. Check if the sample is a cell line or cell type by looking for relevant information in the input JSON. Here, we find that the sample is derived from a patient with mesothelioma. However, there is no mention of it being a specific cell line or cell type. Therefore, we will not add "cell\_line" or "cell\_type" attributes to the output JSON. 5. Extract any disease information from the input JSON. Here, the sample was collected from a patient with mesothelioma. Therefore, we include this information in the output JSON using the "disease" attribute.  After performing these steps, our output JSON will look like: ```json {     "tissue": "lung",     "disease": "mesothelioma" } ``` Note that I have changed the value of the "tissue" attribute to lowercase for consistency.
SAMN36407478	 Based on the given JSON data, I will extract the required information step by step:  1. The 'tissue' attribute in the input data is 'Lung', so the extracted information for tissue would be `"tissue": "lung"`. 2. There is no indication that this sample contains content collected from a tissue, so there is no 'host tissue' attribute to extract. 3. The 'cell line' attribute in the input data is 'H1563', so the extracted information for cell line would be `"cell_line": "H1563"`. 4. The 'cell type' attribute in the input data is 'Lung adenocarcinoma', so the extracted information for cell type would be `"cell_type": "lung adenocarcinoma"`. 5. There is no mention of a disease in this sample, so there is no 'disease' attribute to extract.  Based on these extractions, the final JSON output would be: ```json {     "tissue": "lung",     "cell_line": "H1563",     "cell_type": "lung adenocarcinoma" } ```
