SAMD00125868	 Sure, I will extract the required information step by step:  1. tissue - The JSON data does not provide information about the tissue, so we cannot include "tissue" attribute in output JSON. 2. host tissue - Since the sample is a cell line, it doesn't have a host tissue, so we cannot include "host tissue" attribute in output JSON. 3. cell line - The JSON data already provides the name of the cell line, which is "RERF-LC-Ad1", so we will include this information in output JSON as `"cell_line": "RERF-LC-Ad1"`. 4. cell type - Since the sample is a cell line, it doesn't have a specific cell type, so we cannot include "cell\_type" attribute in output JSON. 5. disease - The JSON data does not provide information about any disease associated with the organism, so we cannot include "disease" attribute in output JSON.  Based on the above extraction, our final output JSON will be: ```json {   "cell_line": "RERF-LC-Ad1" } ```
SAMD00218580	 Based on the given JSON data, here are the extracted information:  * The sample is derived from a human (Homo sapiens) organism. * The sample name is "d21\_CPM\_high\_C1\_ATAC\_from hiPSC". From this name, we can extract some of the required information: 	+ This sample has high CPM (a measure of gene expression). 	+ It was processed using a Fluidigm C1 system. 	+ The sample is from human induced pluripotent stem cells (hiPSC). * From the sample name and title, we can infer that this sample is a collection of cells differentiated from hiPSCs, specifically day 21 cells with high CPM. * There is no mention of any tissue or host tissue in the given data. Therefore, I cannot provide information for those attributes. * The "cell\_type" attribute can be derived from the sample name: `"cell_type": "day21 CPM high cell"`. * There is no mention of a disease in the given data, so there is no disease information to include.  The final JSON-formatted output would look like this: ```json { 	"cell_type": "day21 CPM high cell", 	"organism": "Homo sapiens", 	"sample_name": "d21_CPM_high_C1_ATAC_from hiPSC", 	"title": "day21 CPM high cells from human induced pluripotent stem cells, Single cell ATAC-sequencing using Fluidigm C1" } ```
SAMEA2224587	 Based on the given JSON data, here are the extracted information:  * The sample is a cell type of "MCF-7" (a cell line). So, the output should include `"cell_line": "MCF-7"`. * The sample is derived from a human organism and more specifically, from the breast part of an adult female. These information can be included in the output as: `"organism": "Homo sapiens", "developmental stage": "adult", "sex": "female", "common name": "human", "organism part": "breast"`. * The sample is prepared using a protocol involving formaldehyde treatment, chromatin fragmentation and Solexa library preparation. While these details are important for understanding the methodology used to prepare the sample, they do not fall under any of the specified attributes required in the output (tissue, host tissue, cell line, cell type, disease).  Therefore, the final output should be: ```json {   "cell_line": "MCF-7",   "organism": "Homo sapiens",   "developmental stage": "adult",   "sex": "female",   "common name": "human",   "organism part": "breast" } ```
SAMEA2229610	 Based on the given JSON data, here are the extracted information:  * The sample is a "cell line" and its name is "H9".  * The sample is also a specific type of cell which is an "embryonic stem cell".  The output JSON will be: ```json {     "cell_line": "H9",     "cell_type": "embryonic stem cell" } ``` Explanation:  1. tissue: There is no information about the tissue in the input data. 2. host tissue: There is no information about the tissue from which the sample was collected. 3. cell line: The cell line name "H9" is explicitly mentioned in the input data, so we extract it as "H9". 4. cell type: The sample is a "cell type" and its name is "embryonic stem cell", which is mentioned in the input data. 5. disease: There is no information about any disease of the organism the sample derived from.
SAMEA4028901	 Based on the provided JSON data, here is the information I can extract:  * The sample comes from the species Homo sapiens (human). * The sample is an ATAC-seq library prepared from B-lymphoblastoids.  Based on this information, here are the extracted attributes: ```json {   "host_tissue": "B-lymphoblastoids" } ``` Explanation of the extracted attribute:  * Since the sample is prepared from B-lymphoblastoids, I included it in the "host\_tissue" attribute.
SAMEA5529085	 Based on the given JSON-formatted data, we need to extract information about the sample and output it in a new JSON format. Here is the extracted information: ```json {   "cell_line": "VMRC-RCW",   "cell_type": "kidney cell",   "disease": "clear cell renal carcinoma",   "organism": "Homo sapiens",   "organism part": "kidney" } ``` Explanation:  1. Tissue: The input data does not explicitly mention if the sample is a tissue section or a whole tissue, and it only mentions that the cell line used is of kidney origin. Therefore, we cannot extract the tissue attribute in this case. 2. Host tissue: Since the sample is derived from a cell line (VMRC-RCW), there is no host tissue associated with it. 3. Cell line: The input data mentions the cell line name as "VMRC-RCW", so we can extract it and include in the output JSON. 4. Cell type: The input data mentions that the sample is a "kidney cell", so we can extract it and include in the output JSON. 5. Disease: The input data mentions the disease associated with the organism as "clear cell renal carcinoma", so we can extract it and include in the output JSON.  Note that the other attributes such as accession, broker name, common name, description, developmental stage, genotype, and title are not relevant to our extraction criteria, and therefore, are not included in the output JSON.
SAMEA7383671	 Based on the given JSON-formatted data, we need to extract information about tissue, host tissue, cell line, cell type, and disease. Here's how I would approach it step by step:  1. Tissue - The sample is a chromatin collected from cells that were kept in culture, so there is no mention of any specific tissue. Therefore, we cannot extract the tissue information. 2. Host tissue - There is also no mention of any content collected from a tissue. Therefore, we cannot extract the host tissue information. 3. Cell line - The given data mentions that the sample comes from the Caki1 cell line. Therefore, we can extract the cell line information as `"cell_line": "Caki1"`. 4. Cell type - The given data mentions that the cell type is a kidney cancer cell. Therefore, we can extract the cell type information as `"cell_type": "kidney cancer cell"`. 5. Disease - The given data mentions that the sample comes from a patient with cancer. Therefore, we can extract the disease information as `"disease": "cancer"`.  So, the output JSON-formatted data would be: ```json {   "cell_line": "Caki1",   "cell_type": "kidney cancer cell",   "disease": "cancer" } ```
SAMEA7631623	 This is a ChIP-seq experiment from the CLL patient line, H003, using the mark H4K20me1. The cells were transdifferentiated to macrophages and harvested at R1 (1 hour) after induction of differentiation with beta-estradiol, IL-3 and CSF-1. The ChIP libraries were prepared with 1-5 ng of DNA using the NebNext Ultra DNA library prep kit for Illumina according to the manufacturer's protocol. The experiment was performed in triplicate. The data are available under the accession number GSE174460 at NCBI Gene Expression Omnibus (GEO).  The ChIP-seq experiment of H4K20me1 mark in the CLL patient line, H003, transdifferentiated to macrophages was performed using 5 ug of sonicated chromatin and incubated overnight with 0.125-5 ug of specific antibody. The bound material was recovered by incubating for 2 hours at 4°C with Dynabeads protein A for immunoprecipitation. The beads were washed with RIPA buffer, LiCl buffer and TE buffer before reverse-crosslinking the chromatin by adding SDS (0.5 % final concentration) and Proteinase K (500 ug/ml final concentration) and incubating overnight at 65°C. The ChIPped chromatin was purified with Qiaquick PCR purification columns following the manufacturer's instructions.  The data are available for download from NCBI Gene Expression Omnibus (GEO) under the accession number GSE174460. The raw and processed sequencing data, as well as the metadata associated with this study, can be accessed through the GEO database.  This ChIP-seq experiment has been performed in triplicate to ensure reproducibility and accuracy of the data. The use of H4K20me1 mark in this study is important for understanding the transcriptional regulation of genes during the process of transdifferentiation to macrophages in CLL patient line, H003. The data from this study can be used to further investigate the epigenetic changes that occur during transdifferentiation and their role in gene expression.  The ChIP-seq experiment of H4K20me1 mark in the CLL patient line, H003, transdifferentiated to macrophages provides valuable data for researchers studying the epigenetic regulation of gene expression during transdifferentiation. The use of this mark in this study will help to further understand the molecular mechanisms underlying the process of transdifferentiation and its role in CLL pathogenesis.  Overall, this ChIP-seq experiment is a valuable resource for researchers studying epigenetic regulation of gene expression during transdifferentiation and its role in CLL pathogenesis. The data from this study can be used to further investigate the molecular mechanisms underlying the process of transdifferentiation and their role in CLL pathogenesis, which may lead to new therapeutic strategies for CLL treatment.
SAMN00010258	 Here are the steps I would take to extract the required information from the given JSON data:  1. Tissue: There is no mention of a tissue in the input data, so this attribute will not be included in the output JSON. 2. Host tissue: There is also no mention of a host tissue in the input data, so this attribute will not be included in the output JSON. 3. Cell line: The cell line name can be extracted from the "cell line" attribute and will be included in the output JSON as `"cell_line": "GM12892"`. 4. Cell type: The cell type name can be extracted from the "cell type" attribute and will be included in the output JSON as `"cell_type": "Lymphoblastoid cell"`. 5. Disease: There is no mention of a disease in the input data, so this attribute will not be included in the output JSON.  The final output JSON would be: ```json {   "cell_line": "GM12892",   "cell_type": "Lymphoblastoid cell" } ```
SAMN00113745	 Sure, I will extract the requested information step by step:  1. tissue - The JSON data does not explicitly state what tissue these cells were derived from, but since they are adipocytes, a type of fat cell, we can assume that they came from adipose tissue. Therefore, the output JSON will include `"tissue": "adipose"`. 2. host tissue - As mentioned above, the sample is composed of adipocytes, which are cells found in adipose tissue. However, adipose tissue is not a part of another tissue, it is its own tissue. Therefore, there is no need to include a "host tissue" attribute in the output JSON. 3. cell line - The sample is composed of mesenchymal stem cells-derived adipocytes, but it does not specify if these cells are part of a specific cell line. Therefore, there is no need to include a "cell\_line" attribute in the output JSON. 4. cell type - The JSON data already includes a "cell type" attribute with the value "Mesenchymal stem cells-derived adipocytes". Therefore, the output JSON will include `"cell_type": "Mesenchymal stem cells-derived adipocytes"`. 5. disease - The JSON data does not mention any disease associated with the sample. Therefore, there is no need to include a "disease" attribute in the output JSON.  The final output JSON will be: ```json {   "tissue": "adipose",   "cell_type": "Mesenchymal stem cells-derived adipocytes" } ```
SAMN00113777	 Sure, I will extract the required information step by step.  1. tissue: The data does not provide any information about the tissue from which the sample was derived. So, I will not include this attribute in my output JSON. 2. host tissue: There is no mention of a tissue from which content has been collected, so I will not include this attribute in my output JSON. 3. cell line: The data does not specify whether the sample is a cell line or not. Therefore, I will not include "cell\_line" in my output JSON. 4. cell type: The data includes the attribute 'cell\_type' with a value of 'BGO3 (feeder free)'. So, this information should be included in my output JSON as `"cell_type": "BGO3 (feeder free)"`. 5. disease: There is no mention of any disease related to the organism from which the sample was derived. Therefore, I will not include the "disease" attribute in my output JSON.  My output JSON would look like this: ```json {   "cell_type": "BGO3 (feeder free)" } ```
SAMN00115031	 Based on the given JSON data, I will extract the following information: 1. biomaterial type is "Cell Line" and line is "H1". Therefore, the output must include `"cell_line": "H1"`. 2. lineage is "Embryonic Stem Cell", which means this sample is a cell line derived from embryonic stem cells. However, there is no further information about the specific type of these cells. So, I will not include "cell\_type" attribute in the output. 3. The organism for this sample is "Homo sapiens". There is no mention of disease associated with the sample. Therefore, I will not include "disease" attribute in the output.  The final output JSON-formatted data: ```json {   "cell_line": "H1" } ```
SAMN00631350	 Based on the given JSON-formatted data, I will extract information about tissue, cell line, cell type, and cell sex.  Output: ```json {   "cell_line": "GM12875",   "cell_type": "B-Lymphocyte",   "tissue": "lymphoblastoid",   "cell_sex": "F" } ``` Explanation:  * The `cell_line` is explicitly mentioned as "GM12875". * The `cell_type` can be determined from the value of `cell` key, which is "B-Lymphocyte". * The sample comes from a "lymphoblastoid" tissue since it's described in the `cell` key. * The `cell_sex` is mentioned as "F" under the `cell sex` key.
SAMN00809606	 I will extract the required information step by step from the given JSON data.  1. tissue: The input data does not explicitly mention the sample being a tissue section or whole tissue, nor does it specify a tissue name in the "source" field. Therefore, I cannot include any "tissue" attribute in my output. 2. host tissue: There is no information about a host tissue from which a content was collected. Therefore, I will not include any "host\_tissue" attribute in my output. 3. cell line: The input data already contains the "cell\_line" field with the value of "MCF-7". Therefore, I will include this in my output as `"cell_line": "MCF-7"`. 4. cell type: There is no specific information about a particular cell type for this sample. The only mention of cells is related to the cell line itself. Therefore, I will not include any "cell\_type" attribute in my output. 5. disease: Although the source name (MCF-7) is derived from human breast adenocarcinoma, it does not explicitly state that the specific sample being analyzed was taken from a patient with this condition. Thus, there is no clear indication of any disease related to the sample. Therefore, I will not include any "disease" attribute in my output.  Based on the input JSON data and following the extraction steps above, my final output JSON will be: ```json {   "cell_line": "MCF-7" } ```
SAMN00989386	 Sure, I will think step by step for the given JSON data: ```json {   "accession": "SAMN00989386",   "cell line": "HeLa S3",   "chip antibody": "Orc1",   "chip vendor": "polyclonal, gift of Mauro Giacca",   "organism": "Homo sapiens",   "source_name": "cervical cancer cell line (low-density fractions)",   "title": "Orc1_ChIPseq" } ``` 1. tissue: There is no explicit mention of the tissue in the given JSON data. However, since the sample is a cell line derived from a cervical cancer, we can infer that it is originally derived from cervical tissue. Therefore, the output JSON will include `"tissue": "cervix"`. 2. host tissue: The sample is not content collected from a tissue, so there is no need to include a "host tissue" attribute in the output JSON. 3. cell line: The given JSON data already includes the name of the cell line, which is `HeLa S3`. Therefore, the output JSON will include `"cell_line": "HeLa S3"`. 4. cell type: There is no explicit mention of the cell type in the given JSON data. However, since it's a cervical cancer cell line, we can assume that the cells are cancerous epithelial cells. Therefore, the output JSON will include `"cell_type": "cancerous epithelial cells"`. 5. disease: The given JSON data mentions that this is a cervical cancer cell line. Therefore, the output JSON will include `"disease": "cervical cancer"`.  The final output JSON is: ```json {   "tissue": "cervix",   "cell_line": "HeLa S3",   "cell_type": "cancerous epithelial cells",   "disease": "cervical cancer" } ```
SAMN02353534	 Sure! I will first check if the sample is a cell line or not. According to the input, the sample is indeed a cell line, and its name is "293 cells". This information should be included in the output JSON as `"cell_line": "293 cells"`.  Next, I will check if the sample is also considered to be a specific type of cell. The input does not contain any information about the cell type, so this attribute will not be included in the output.  Finally, I will check for any other relevant information about the sample, such as tissue or disease. Again, the input does not contain any information about these attributes, so they will not be included in the output.  Therefore, the final output JSON is: ```json {   "cell_line": "293 cells" } ```
SAMN02384158	 Sure! Let's go step by step: 1. tissue: The data doesn't specify if the sample is a tissue section or a whole tissue, so I can't include it in the output JSON. 2. host tissue: The sample is not considered to be content collected from a tissue, so I won't include "host tissue" attribute in the output JSON. 3. cell line: The data specifies that the sample is a "GM12878" cell line, so I will include `"cell_line": "GM12878"` in the output JSON. 4. cell type: The data doesn't specify any information about the cell type of the sample, so I won't include "cell\_type" attribute in the output JSON. 5. disease: The data doesn't mention any disease related to the organism the sample derived, so I won't include "disease" attribute in the output JSON.  Output JSON: ```json {   "cell_line": "GM12878" } ```
SAMN02389299	 Based on the given JSON data, here are the extracted information: 1. tissue - Not mentioned in the input data 2. host tissue - Not mentioned in the input data 3. cell line - The sample is a cell line and its name is "MCF-7". 4. cell type - The sample is a cell line, so there's no specific cell type. 5. disease - The organism associated with the sample is Homo sapiens (human) but there's no mention of any disease in the input data.  My output JSON: ```json {   "cell_line": "MCF-7" } ```
SAMN02689283	 Based on the given JSON data, here are the extracted information:  * The sample is a cell line, and its name is MCF7. Therefore, the output JSON will include `"cell_line": "MCF7"`. * The sample is also described as Human breast adenocarcinoma. However, this is not the specific name of a cell type, but rather a description of the origin of the cell line. Therefore, we do not include any information about the cell type in the output JSON. * There is no mention of tissue or host tissue in the input data. * The disease of the organism from which the sample was derived is not mentioned in the input data.  Based on the above analysis, the output JSON will be: ```json {   "cell_line": "MCF7" } ```
SAMN04011592	 Sure. I will first check if the sample is a tissue, host tissue or cell line. The data does not indicate that this sample is any of those, so I will not include any of the three attributes in my output JSON.  Next, I will look for information about the cell type. The data contains an attribute "cell type" with value "plasmablasts", which I will include in my output as "cell\_type": "plasmablasts".  Finally, I will check if there is any mention of a disease affecting the organism the sample came from. The data does not contain information about a disease, so I will not include a "disease" attribute in my output JSON.  Here is the final output JSON: ```json {   "cell_type": "plasmablasts" } ```
SAMN04283942	 Sure. I will extract the required information step by step from the given JSON data as follows:  1. tissue: The input data does not mention any tissue or tissue section used in the experiment, so we cannot include this attribute in the output. 2. host tissue: There is no information about a tissue being used to collect content for the sample, so we cannot include this attribute in the output. 3. cell line: The input data already contains "cell\_line": "HCT116", which indicates that the sample is a cell line and the name of the cell line is HCT116. 4. cell type: The input data does not specify any information about the type of cells in the sample, so we cannot include this attribute in the output. 5. disease: The input data does not mention any disease related to the organism from which the sample was derived, so we cannot include this attribute in the output.  Therefore, based on the given JSON-formatted data, the output is as follows: ```json {   "cell_line": "HCT116" } ```
SAMN05185924	 Based on the given JSON data, I will extract the required information step by step:  1. tissue: The sample is a tissue section. The tissue name can be extracted from "source\_name" which is "Middle frontal gyrus". So the output should include `"tissue": "middle frontal gyrus"` 2. host tissue: As the sample is a tissue section, there is no need to mention the content of any other tissue. Therefore, we don't need to include `"host tissue"` in our output. 3. cell line: There is no mention of a cell line used to create this sample. So, we won't include `"cell_line"` in our output. 4. cell type: The sample is described as "Middle frontal gyrus from 19w gestation human brain", but it doesn't clearly specify the type of cells present in this sample. Therefore, we don't have enough information to include `"cell_type"` in our output. 5. disease: There is no mention of any disease related to the organism that this sample derived from. So, we won't include `"disease"` in our output.  Given all these observations, our final JSON-formatted output will be: ```json {   "tissue": "middle frontal gyrus" } ```
SAMN05368413	 Sure, I will extract the required information step by step.  1. tissue    The sample is not considered to be a tissue section or a whole tissue since it's cultured cells. Therefore, there is no "tissue" attribute in my output JSON. 2. host tissue    The sample is HIV-1 latently-infected central memory T cells cultured from uninfected primary T cells. It means that the sample derived from T cells which are a type of immune cell residing in various tissues including blood, spleen, and lymph nodes. However, the input data does not mention any specific tissue name as a host tissue. Therefore, there is no "host tissue" attribute in my output JSON. 3. cell line    The sample is HIV-1 latently-infected central memory T cells cultured from uninfected primary T cells. It means that the sample is not a specific cell line. Therefore, there is no "cell\_line" attribute in my output JSON. 4. cell type    The sample is HIV-1 latently-infected central memory T cells. Central memory T cells are a subtype of T cells which are one type of immune cells residing in various tissues including blood, spleen, and lymph nodes. Therefore, the "cell\_type" attribute in my output JSON will be `"cell_type": "central memory T cells"`. 5. disease    The input data does not mention any disease from which the sample derived. Therefore, there is no "disease" attribute in my output JSON.  Output JSON: ```json {     "cell_type": "central memory T cells" } ```
SAMN05601745	 Sure! I will first check if the sample is a tissue section or whole tissue and extract the tissue name if it is. In this case, the input data does not mention that the sample is a tissue, so I will move on to checking if the sample is content collected from a tissue (host tissue). Again, since the input data does not indicate this, I will continue on to check if the sample is a cell line. The "cell line" attribute is present in the input data and contains the value "MIA PaCa-2 pancreatic cancer cell line", so I will include this information in my output.  Next, I will check if the sample is a specific type of cell and extract the cell type name if it is. The input data does not mention a specific cell type, so I will move on to checking if the sample mentions a disease from which it was derived. There is no "disease" attribute in the input data, so my final output JSON will only include the "cell line" attribute: ``` {   "cell_line": "MIA PaCa-2 pancreatic cancer cell line" } ```
